{
  "$schema": "https://json-schema.org/draft/2020-12/schema",
  "$id": "https://github.com/agentpatternscatalog/patterns/compositions-todo.schema.json",
  "title": "Compositions To Add — Pattern Usage Coverage Worklist",
  "description": "Tracks catalog patterns that lack a real, documented usage in a shipping framework, application, or service, and the candidate compositions found to fill each gap. A pattern with zero documented uses is unproven in practice. Items graduate by having a verified usage added to a compositions-src/ shard. Generated and refreshed by _build_compositions_todo.py; candidate research is hand-added and preserved across regenerations. Pure data, no code.",
  "type": "object",
  "additionalProperties": false,
  "required": ["last_updated", "items"],
  "properties": {
    "$schema": {"type": "string"},
    "title": {"type": "string"},
    "description": {"type": "string"},
    "last_updated": {"type": "string", "format": "date"},
    "summary": {
      "type": "object",
      "additionalProperties": true,
      "description": "Headline counts, regenerated each run."
    },
    "items": {
      "type": "array",
      "description": "One entry per pattern lacking documented framework/app/service usage.",
      "items": {
        "type": "object",
        "additionalProperties": false,
        "required": ["pattern", "status"],
        "properties": {
          "pattern": {"type": "string", "pattern": "^[a-z0-9][a-z0-9-]*$"},
          "name": {"type": "string"},
          "category": {"type": "string"},
          "is_anti_pattern": {"type": "boolean"},
          "maturity": {"type": "string"},
          "usage_count": {"type": "integer", "minimum": 0, "description": "Current count of framework compositions implementing this pattern (non-anti-pattern role)."},
          "avoided_count": {"type": "integer", "minimum": 0, "description": "Anti-patterns only: count of frameworks that explicitly design against this anti-pattern."},
          "status": {
            "type": "string",
            "enum": ["todo", "scanning", "candidate-found", "added", "no-public-usage"],
            "description": "todo = not yet researched; scanning = research in progress; candidate-found = ≥1 evidenced candidate recorded, not yet wired into a shard; added = usage written to compositions-src/ (item will drop on next regen); no-public-usage = research done, no documented real-world usage found (pattern stays experimental)."
          },
          "candidates": {
            "type": "array",
            "description": "Real frameworks/apps/services found to implement this pattern, with upstream evidence.",
            "items": {
              "type": "object",
              "additionalProperties": false,
              "required": ["framework", "role", "evidence"],
              "properties": {
                "framework": {"type": "string", "description": "Human name of the framework/app/service."},
                "composition_id": {"type": "string", "description": "Existing composition id to extend, or proposed id for a new composition."},
                "vendor": {"type": "string"},
                "url": {"type": "string"},
                "role": {
                  "type": "string",
                  "enum": ["core", "first-class", "supported", "limited", "via-integration", "opt-in", "anti-pattern", "unknown"]
                },
                "note": {"type": "string", "description": "How the framework realises the pattern (class, decorator, config, workflow)."},
                "evidence": {
                  "type": "array",
                  "minItems": 1,
                  "items": {
                    "type": "object",
                    "additionalProperties": false,
                    "required": ["type", "url"],
                    "properties": {
                      "type": {"type": "string", "enum": ["doc", "repo", "blog", "paper", "talk", "spec", "changelog", "issue", "tutorial", "api-ref"]},
                      "title": {"type": "string"},
                      "url": {"type": "string"},
                      "quote": {"type": "string"},
                      "accessed": {"type": "string", "format": "date"}
                    }
                  }
                },
                "verified": {"type": "boolean", "description": "True once the evidence url+quote has been confirmed against upstream."}
              }
            }
          },
          "notes": {"type": "string"}
        }
      }
    },
    "composition_candidates": {
      "type": "array",
      "description": "New framework/app/service compositions worth authoring (e.g. a successor product that an existing entry points to but that is not yet catalogued). Each becomes a full kind=framework entry in a compositions-src/ shard once researched, adding usage refs to the patterns it implements.",
      "items": {
        "type": "object",
        "additionalProperties": false,
        "required": ["id", "name", "reason"],
        "properties": {
          "id": {"type": "string", "pattern": "^[a-z0-9][a-z0-9-]*$"},
          "name": {"type": "string"},
          "category": {"type": "string"},
          "vendor": {"type": "string"},
          "url": {"type": "string"},
          "reason": {"type": "string", "description": "Why it belongs in the catalog (e.g. successor of <id>, referenced by <id>)."},
          "predecessor": {"type": "string", "description": "If this is a successor, the existing composition id it replaces (re-add its successor field once authored)."},
          "covers": {"type": "array", "items": {"type": "string"}, "description": "Zero-usage pattern ids this product implements (the reason to author it). A composition needs >=2 members; products covering only one listed pattern need a second well-known member found during authoring."},
          "needs_second_member": {"type": "boolean", "description": "True when 'covers' has a single pattern — authoring requires finding one more pattern this product documents to satisfy the >=2 members rule."}
        }
      }
    },
    "authoring_candidates": {
      "type": "array",
      "description": "New patterns (often anti-patterns) worth authoring because a real framework already documents the behaviour — authoring them yields a pattern that ships with a documented usage. Distinct from pattern-todo.json (general candidates); these are specifically surfaced by composition reference work.",
      "items": {
        "type": "object",
        "additionalProperties": false,
        "required": ["pattern", "kind", "raised_by"],
        "properties": {
          "pattern": {"type": "string"},
          "name": {"type": "string"},
          "kind": {"type": "string", "enum": ["pattern", "anti-pattern"]},
          "category_hint": {"type": "string"},
          "summary": {"type": "string"},
          "raised_by": {
            "type": "array",
            "items": {
              "type": "object",
              "additionalProperties": false,
              "required": ["composition", "note"],
              "properties": {
                "composition": {"type": "string"},
                "note": {"type": "string"},
                "evidence": {
                  "type": "array",
                  "items": {
                    "type": "object",
                    "additionalProperties": false,
                    "required": ["type", "url"],
                    "properties": {
                      "type": {"type": "string"},
                      "title": {"type": "string"},
                      "url": {"type": "string"},
                      "quote": {"type": "string"},
                      "accessed": {"type": "string"}
                    }
                  }
                }
              }
            }
          }
        }
      }
    }
  }
}
