{
  "$schema": "./compositions-todo.schema.json",
  "title": "Pattern Usage Coverage — Compositions To Add",
  "description": "Worklist of catalog patterns that lack a real, documented usage in a shipping framework, application, or service. A pattern with zero documented uses is unproven in practice. Each item collects candidate frameworks/apps/services that implement the pattern, with verifiable upstream evidence (url + verbatim quote). Items graduate by having a verified usage added to a compositions-src/ shard, after which this worklist is regenerated and the item drops off. Generated by _build_compositions_todo.py; candidate research is hand-added and preserved across regenerations.",
  "last_updated": "2026-09-04",
  "summary": {
    "zero_usage_normal_patterns": 91,
    "zero_usage_anti_patterns": 106,
    "anti_patterns_without_avoided_coverage": 50,
    "normal_by_category": {
      "safety-control": 17,
      "planning-control-flow": 14,
      "governance-observability": 9,
      "memory": 9,
      "multi-agent": 8,
      "tool-use-environment": 8,
      "cognition-introspection": 6,
      "reasoning": 6,
      "structure-data": 4,
      "verification-reflection": 4,
      "retrieval": 2,
      "streaming-ux": 2,
      "routing-composition": 2
    }
  },
  "items": [
    {
      "pattern": "cognitive-move-selector",
      "name": "Cognitive-Move Selector",
      "category": "cognition-introspection",
      "is_anti_pattern": false,
      "maturity": "experimental",
      "usage_count": 0,
      "avoided_count": 0,
      "status": "todo",
      "candidates": [],
      "notes": ""
    },
    {
      "pattern": "cooperative-preference-inference",
      "name": "Cooperative Preference Inference",
      "category": "cognition-introspection",
      "is_anti_pattern": false,
      "maturity": "experimental",
      "usage_count": 0,
      "avoided_count": 0,
      "status": "todo",
      "candidates": [],
      "notes": ""
    },
    {
      "pattern": "fragment-juxtaposition",
      "name": "Fragment Juxtaposition",
      "category": "cognition-introspection",
      "is_anti_pattern": false,
      "maturity": "experimental",
      "usage_count": 0,
      "avoided_count": 0,
      "status": "todo",
      "candidates": [],
      "notes": ""
    },
    {
      "pattern": "parallel-voice-proposer",
      "name": "Parallel-Voice Proposer",
      "category": "cognition-introspection",
      "is_anti_pattern": false,
      "maturity": "experimental",
      "usage_count": 0,
      "avoided_count": 0,
      "status": "todo",
      "candidates": [],
      "notes": ""
    },
    {
      "pattern": "subject-first-agent-architecture",
      "name": "Subject-First Agent Architecture (ENA Stateful Core)",
      "category": "cognition-introspection",
      "is_anti_pattern": false,
      "maturity": "experimental",
      "usage_count": 0,
      "avoided_count": 0,
      "status": "todo",
      "candidates": [],
      "notes": ""
    },
    {
      "pattern": "attention-manipulation-explainability",
      "name": "Attention-Manipulation Explainability",
      "category": "governance-observability",
      "is_anti_pattern": false,
      "maturity": "experimental",
      "usage_count": 0,
      "avoided_count": 0,
      "status": "candidate-found",
      "candidates": [
        {
          "framework": "Inseq",
          "composition_id": "inseq",
          "vendor": "Inseq Team (Gabriele Sarti et al.)",
          "url": "https://inseq.org",
          "role": "core",
          "note": "Inseq is a shipping Python feature-attribution library for generative LLMs that produces per-token attribution maps, including attention-based attribution extracting attention weights across all transformer layers and heads as the per-token relevance score; it surfaces relevance via weight extraction rather than ablation-perturbation strictly.",
          "evidence": [
            {
              "type": "doc",
              "title": "Attention Attribution — Inseq Documentation",
              "url": "https://inseq.org/en/latest/main_classes/feature_attribution.html",
              "quote": "Attention weights attribution method. Attribution method that returns the attention weights of the model as attribution scores. The attention weights are averaged across all layers and heads, or a single layer can be selected.",
              "accessed": "2026-06-17"
            },
            {
              "type": "repo",
              "title": "inseq-team/inseq — Interpretability for Sequence Generation Models",
              "url": "https://github.com/inseq-team/inseq",
              "quote": "Inseq is a Pytorch-based hackable toolkit to democratize the access to common post-hoc interpretability analyses of sequence generation models.",
              "accessed": "2026-06-17"
            }
          ],
          "verified": false
        }
      ],
      "notes": ""
    },
    {
      "pattern": "determinism-tier-replay-gate",
      "name": "Determinism-Tiered Replay Gate",
      "category": "governance-observability",
      "is_anti_pattern": false,
      "maturity": "experimental",
      "usage_count": 0,
      "avoided_count": 0,
      "status": "todo",
      "candidates": [],
      "notes": ""
    },
    {
      "pattern": "multi-principal-welfare-aggregation",
      "name": "Multi-Principal Welfare Aggregation",
      "category": "governance-observability",
      "is_anti_pattern": false,
      "maturity": "experimental",
      "usage_count": 0,
      "avoided_count": 0,
      "status": "todo",
      "candidates": [],
      "notes": ""
    },
    {
      "pattern": "context-folding",
      "name": "Context Folding",
      "category": "memory",
      "is_anti_pattern": false,
      "maturity": "experimental",
      "usage_count": 0,
      "avoided_count": 0,
      "status": "todo",
      "candidates": [],
      "notes": ""
    },
    {
      "pattern": "landmark-attention",
      "name": "Landmark Attention",
      "category": "memory",
      "is_anti_pattern": false,
      "maturity": "experimental",
      "usage_count": 0,
      "avoided_count": 0,
      "status": "todo",
      "candidates": [],
      "notes": ""
    },
    {
      "pattern": "test-time-memorization",
      "name": "Test-Time Memorization (Titans)",
      "category": "memory",
      "is_anti_pattern": false,
      "maturity": "experimental",
      "usage_count": 0,
      "avoided_count": 0,
      "status": "todo",
      "candidates": [],
      "notes": ""
    },
    {
      "pattern": "cellular-automata-agents",
      "name": "Cellular-Automata Agents",
      "category": "multi-agent",
      "is_anti_pattern": false,
      "maturity": "experimental",
      "usage_count": 0,
      "avoided_count": 0,
      "status": "todo",
      "candidates": [],
      "notes": ""
    },
    {
      "pattern": "coalition-formation",
      "name": "Coalition Formation",
      "category": "multi-agent",
      "is_anti_pattern": false,
      "maturity": "experimental",
      "usage_count": 0,
      "avoided_count": 0,
      "status": "todo",
      "candidates": [],
      "notes": ""
    },
    {
      "pattern": "joint-commitment-team",
      "name": "Joint Commitment Team",
      "category": "multi-agent",
      "is_anti_pattern": false,
      "maturity": "experimental",
      "usage_count": 0,
      "avoided_count": 0,
      "status": "todo",
      "candidates": [],
      "notes": ""
    },
    {
      "pattern": "rl-conductor-orchestrator",
      "name": "RL-Trained Conductor Orchestrator",
      "category": "multi-agent",
      "is_anti_pattern": false,
      "maturity": "experimental",
      "usage_count": 0,
      "avoided_count": 0,
      "status": "candidate-found",
      "candidates": [
        {
          "framework": "Puppeteer (Multi-Agent Collaboration via Evolving Orchestration)",
          "composition_id": "puppeteer-rl-orchestrator",
          "vendor": "Tsinghua (Chen Qian et al.)",
          "url": "https://arxiv.org/abs/2505.19591",
          "role": "core",
          "note": "A centralized orchestrator trained with reinforcement learning adaptively sequences and prioritizes a pool of LLM agents per task state, learning the collaboration topology end-to-end.",
          "evidence": [
            {
              "type": "paper",
              "title": "Multi-Agent Collaboration via Evolving Orchestration (arXiv:2505.19591)",
              "url": "https://arxiv.org/abs/2505.19591",
              "quote": "This orchestrator is trained via reinforcement learning to adaptively sequence and prioritize agents, enabling flexible and evolvable collective reasoning.",
              "accessed": "2026-06-17"
            }
          ],
          "verified": false
        }
      ],
      "notes": ""
    },
    {
      "pattern": "adaptive-branching-tree-search",
      "name": "Adaptive Branching Tree Search",
      "category": "planning-control-flow",
      "is_anti_pattern": false,
      "maturity": "experimental",
      "usage_count": 0,
      "avoided_count": 0,
      "status": "todo",
      "candidates": [],
      "notes": ""
    },
    {
      "pattern": "behavior-tree-back-chaining",
      "name": "Behavior Tree Back Chaining",
      "category": "planning-control-flow",
      "is_anti_pattern": false,
      "maturity": "experimental",
      "usage_count": 0,
      "avoided_count": 0,
      "status": "todo",
      "candidates": [],
      "notes": ""
    },
    {
      "pattern": "distributed-constraint-optimization",
      "name": "Distributed Constraint Optimization",
      "category": "planning-control-flow",
      "is_anti_pattern": false,
      "maturity": "experimental",
      "usage_count": 0,
      "avoided_count": 0,
      "status": "todo",
      "candidates": [],
      "notes": ""
    },
    {
      "pattern": "mental-model-in-the-loop-simulator",
      "name": "Mental-Model-In-The-Loop Simulator",
      "category": "planning-control-flow",
      "is_anti_pattern": false,